canonical_url,registry_id,page_type,exported_url,exported_status,last_crawled,crawl_age_days_on_2026-07-14,manifest_normalization,current_registry,current_sitemap,current_build,production_http_2026_07_14,homepage_depth,unique_same_locale_inbound,approx_content_words,decision,follow_up,rationale
https://www.halatao.cz/cs/sablony/,hub-templates.cs,hub,https://www.halatao.cz/cs/sablony,"Procházeno – momentálně neindexováno",2026-05-20,55,"/cs/sablony -> /cs/sablony/ (conceptual manifest mapping)",active-indexable,present,"present; self-canonical; lang=cs","200 GET; self-canonical; index,follow",1,81,275,KEEP,MONITOR AFTER RECRAWL,"Required taxonomy hub with stable footer discovery and generated child links; the exported signal belongs to the old no-slash URL and predates the current navigation and URL layer."
https://www.halatao.cz/cs/sablony/checklist-api-integrace/,tool-api-integration-checklist.cs,tool,https://www.halatao.cz/cs/sablony/checklist-api-integrace,"Procházeno – momentálně neindexováno",2026-05-20,55,"/cs/sablony/checklist-api-integrace -> /cs/sablony/checklist-api-integrace/ (conceptual manifest mapping)",active-indexable,present,"present; self-canonical; lang=cs","200 GET; self-canonical; index,follow",2,9,252,EXPAND,MONITOR AFTER RECRAWL,"Keep the checklist intent distinct from the API technology and service pages; add reusable fields, failure/retry ownership, monitoring prompts, and a short completed example."
https://www.halatao.cz/cs/sablony/scope-worksheet-pro-interni-system/,tool-internal-tool-scope-worksheet.cs,tool,https://www.halatao.cz/cs/sablony/scope-worksheet-pro-interni-system,"Procházeno – momentálně neindexováno",2026-05-19,56,"/cs/sablony/scope-worksheet-pro-interni-system -> /cs/sablony/scope-worksheet-pro-interni-system/ (conceptual manifest mapping)",active-indexable,present,"present; self-canonical; lang=cs","200 GET; self-canonical; index,follow",2,3,292,EXPAND,MONITOR AFTER RECRAWL,"The worksheet has a distinct working-tool intent; add concrete prompts and a role-state-exception-data worksheet with a compact filled example."
https://www.halatao.cz/cs/sablony/checklist-prevzeti-aplikace/,tool-app-takeover-checklist.cs,tool,https://www.halatao.cz/cs/sablony/checklist-prevzeti-aplikace,"Procházeno – momentálně neindexováno",2026-05-09,66,"/cs/sablony/checklist-prevzeti-aplikace -> /cs/sablony/checklist-prevzeti-aplikace/ (conceptual manifest mapping)",active-indexable,present,"present; self-canonical; lang=cs","200 GET; self-canonical; index,follow",2,3,259,EXPAND,MONITOR AFTER RECRAWL,"Retain it as the practical companion to the takeover guides; add evidence, owner, status, priority, and handover-output fields instead of duplicating narrative guidance."
https://www.halatao.cz/cs/sablony/discovery-checklist-pro-automatizace/,tool-automation-discovery-checklist.cs,tool,https://www.halatao.cz/cs/sablony/discovery-checklist-pro-automatizace,"Procházeno – momentálně neindexováno",2026-05-21,54,"/cs/sablony/discovery-checklist-pro-automatizace -> /cs/sablony/discovery-checklist-pro-automatizace/ (conceptual manifest mapping)",active-indexable,present,"present; self-canonical; lang=cs","200 GET; self-canonical; index,follow",2,3,304,EXPAND,MONITOR AFTER RECRAWL,"Strengthen the page as a reusable discovery worksheet with explicit process, exception, ownership, data, and impact checks; the guide should continue to own the how-to narrative."
https://www.halatao.cz/cs/pruvodce/jak-pripravit-takeover-audit-aplikace/,guide-how-to-run-app-takeover-audit.cs,guide,https://www.halatao.cz/cs/pruvodce/jak-pripravit-takeover-audit-aplikace,"Procházeno – momentálně neindexováno",2026-05-26,49,"/cs/pruvodce/jak-pripravit-takeover-audit-aplikace -> /cs/pruvodce/jak-pripravit-takeover-audit-aplikace/ (conceptual manifest mapping)",active-indexable,present,"present; self-canonical; lang=cs","200 GET; self-canonical; index,follow",2,6,323,EXPAND,MONITOR AFTER RECRAWL,"Preserve the informational audit-process intent; add audit phases, evidence, outputs, risk prioritization, and a decision framework while the checklist remains the working tool."
https://www.halatao.cz/cs/technologie/api-integrace/,technology-api-integrations.cs,technology,https://www.halatao.cz/cs/technologie/api-integrace,"Procházeno – momentálně neindexováno",2026-05-21,54,"/cs/technologie/api-integrace -> /cs/technologie/api-integrace/ (conceptual manifest mapping)",active-indexable,present,"present; self-canonical; lang=cs","200 GET; self-canonical; index,follow",2,3,255,EXPAND,MONITOR AFTER RECRAWL,"Keep the technology and decision intent separate from the checklist and transactional service; add integration patterns, sync versus async trade-offs, idempotency, retry, observability, and business-fit examples."
